{
  "schema_version": "1.0.0",
  "record_type": "EXECUTION_ADMISSION_PREFLIGHT_CONTRACTS_v1",
  "contracts_id": "execution-admission-preflight-contracts-v1",
  "contracts_version": "v1",
  "generated_for_branch_or_commit": "bc0f46ebcbb39013e3ccc9aa2b7a945c1b1d4593",
  "candidate_matrix_ref": "examples/execution-admission/execution_admission_candidate_matrix_v1.json",
  "approval_phrase_format": "APPROVE EXECUTION ADMISSION <candidate_id>",
  "production_ready_claimed": false,
  "publication_admitted_claimed": false,
  "real_execution_admission_status": "blocked",
  "publication_admission_status": "blocked",
  "admitted_noop_receipt_candidate_ids": [
    "release_candidate_package_receipt_noop_v1"
  ],
  "admitted_real_execution_candidate_ids": [],
  "admitted_publication_candidate_ids": [],
  "real_execution_preflight_passed_candidate_ids": [],
  "publication_preflight_passed_candidate_ids": [],
  "contracts": [
    {
      "candidate_id": "release_candidate_package_receipt_noop_v1",
      "candidate_type": "no_op_receipt",
      "preflight_contract_version": "v1",
      "preflight_status": "requirements_defined",
      "admission_status": "admitted_no_op_only",
      "current_candidate_matrix_status": "admitted",
      "requires_explicit_approval": true,
      "approval_phrase": "APPROVE EXECUTION ADMISSION release_candidate_package_receipt_noop_v1",
      "approval_decision_reference_required": true,
      "required_inputs": [
        "examples/execution-admission/release_candidate_package_receipt_noop_execution_admission_decision_approved.json",
        "examples/real-pilot-release-candidate-package/max_biped_v1_real_pilot_release_candidate_package_pass.json"
      ],
      "forbidden_inputs": [
        "Cache/**",
        "**/assetdb.sqlite",
        "production/**",
        "engine/**"
      ],
      "allowed_sandbox_paths": [
        "examples/sandbox/execution-receipts/release-candidate-package-receipt-noop"
      ],
      "forbidden_paths": [
        "production/**",
        "engine/**",
        "Cache/**",
        "**/assetdb.sqlite"
      ],
      "allowed_outputs": [
        "examples/sandbox/execution-receipts/release-candidate-package-receipt-noop/*.json"
      ],
      "forbidden_outputs": [
        "production/**",
        "engine/**",
        "Cache/**"
      ],
      "required_evidence": [
        "real_pilot_release_candidate_package_v1 pass report",
        "production_readiness_report_v1 blocked_for_execution",
        "approved no-op admission decision"
      ],
      "required_receipt_schema": "schemas/maxine_release_candidate_package_receipt_noop_report.schema.json",
      "receipt_required": true,
      "rollback_plan_required": true,
      "operator_approval_required": true,
      "expected_validator": "tools/execution-admission/validate_release_candidate_package_receipt_noop_report.py",
      "expected_tests": [
        "tests/pytest/test_release_candidate_package_receipt_noop_admission.py",
        "tests/pytest/test_release_candidate_package_receipt_noop_report_schema.py"
      ],
      "blocked_surfaces": [
        "o3de_execution",
        "editor_runtime_execution",
        "asset_processor_execution",
        "blender_dcc_execution",
        "profiler_benchmark_execution",
        "live_screenshot_capture",
        "spawn_publish",
        "cache_live_db_access",
        "authoritative_source_uuid_claims",
        "authoritative_asset_id_claims",
        "authoritative_product_id_claims",
        "production_write",
        "engine_write"
      ],
      "allowed_surface_summary": "No-op receipt generation only; external execution and publication remain blocked.",
      "failure_conditions": [
        "external_execution_performed is true",
        "publication_performed is true",
        "receipt output outside sandbox path"
      ],
      "production_readiness_effect": "requirements_only_review_ready",
      "publication_effect": "noop_only_not_publication",
      "safety_notes": [
        "No-op receipt admission is not real execution admission.",
        "No-op receipt admission is not publication admission."
      ]
    },
    {
      "candidate_id": "dcc_conform_execution_v1",
      "candidate_type": "real_execution",
      "preflight_contract_version": "v1",
      "preflight_status": "requirements_defined",
      "admission_status": "unadmitted",
      "current_candidate_matrix_status": "proposed",
      "requires_explicit_approval": true,
      "approval_phrase": "APPROVE EXECUTION ADMISSION dcc_conform_execution_v1",
      "approval_decision_reference_required": true,
      "required_inputs": [
        "examples/sandbox/dcc-conform-evidence/pilot-candidates/*.json",
        "examples/sandbox/max-biped-skeleton-evidence/pilot-candidates/*.json"
      ],
      "forbidden_inputs": [
        "Cache/**",
        "**/assetdb.sqlite",
        "production/**",
        "engine/**"
      ],
      "allowed_sandbox_paths": [
        "examples/sandbox/dcc-conform-evidence",
        "examples/sandbox/execution-receipts"
      ],
      "forbidden_paths": [
        "production/**",
        "engine/**",
        "Cache/**",
        "**/assetdb.sqlite"
      ],
      "allowed_outputs": [
        "examples/sandbox/dcc-conform-evidence/**",
        "examples/sandbox/execution-receipts/**"
      ],
      "forbidden_outputs": [
        "production/**",
        "engine/**",
        "Cache/**"
      ],
      "required_evidence": [
        "dcc_conform_v1 controlled_real evidence pass",
        "manual_hero_review_v1 pass",
        "aaa_performance_budget_v1 pass"
      ],
      "required_receipt_schema": "schemas/maxine_execution_admission_receipt_dry_run_report.schema.json",
      "receipt_required": true,
      "rollback_plan_required": true,
      "operator_approval_required": true,
      "expected_validator": "tools/execution-admission/validate_execution_admission_preflight_contracts.py",
      "expected_tests": [
        "tests/pytest/test_execution_admission_preflight_contracts.py",
        "tests/pytest/test_dcc_conform_report.py"
      ],
      "blocked_surfaces": [
        "o3de_execution",
        "editor_runtime_execution",
        "asset_processor_execution",
        "blender_dcc_execution",
        "profiler_benchmark_execution",
        "live_screenshot_capture",
        "spawn_publish",
        "cache_live_db_access",
        "authoritative_source_uuid_claims",
        "authoritative_asset_id_claims",
        "authoritative_product_id_claims",
        "production_write",
        "engine_write"
      ],
      "allowed_surface_summary": "Requirements-only contract; no DCC tool execution admitted in this slice.",
      "failure_conditions": [
        "approval phrase missing",
        "required evidence missing",
        "blocked surfaces widened"
      ],
      "production_readiness_effect": "requirements_only_execution_blocked",
      "publication_effect": "publication_blocked",
      "safety_notes": [
        "Preflight requirements do not grant execution admission.",
        "Publication remains blocked."
      ]
    },
    {
      "candidate_id": "asset_processor_batch_execution_v1",
      "candidate_type": "real_execution",
      "preflight_contract_version": "v1",
      "preflight_status": "blocked",
      "admission_status": "unadmitted",
      "current_candidate_matrix_status": "blocked",
      "requires_explicit_approval": true,
      "approval_phrase": "APPROVE EXECUTION ADMISSION asset_processor_batch_execution_v1",
      "approval_decision_reference_required": true,
      "required_inputs": [
        "examples/sandbox/ap-binary-preflights/*.json",
        "examples/sandbox/ap-execution-preflights/*.json"
      ],
      "forbidden_inputs": [
        "Cache/**",
        "**/assetdb.sqlite",
        "production/**",
        "engine/**"
      ],
      "allowed_sandbox_paths": [
        "examples/sandbox/ap-diagnostic-executions",
        "examples/sandbox/ap-real-binary-diagnostic-executions",
        "examples/sandbox/execution-receipts"
      ],
      "forbidden_paths": [
        "production/**",
        "engine/**",
        "Cache/**",
        "**/assetdb.sqlite"
      ],
      "allowed_outputs": [
        "examples/sandbox/ap-diagnostic-executions/**",
        "examples/sandbox/ap-real-binary-diagnostic-executions/**",
        "examples/sandbox/execution-receipts/**"
      ],
      "forbidden_outputs": [
        "production/**",
        "engine/**",
        "Cache/**"
      ],
      "required_evidence": [
        "ap execution preflight readiness evidence",
        "ap binary preflight readiness evidence",
        "release_publication_gate_set_v1 pass"
      ],
      "required_receipt_schema": "schemas/maxine_execution_admission_receipt_dry_run_report.schema.json",
      "receipt_required": true,
      "rollback_plan_required": true,
      "operator_approval_required": true,
      "expected_validator": "tools/execution-admission/validate_execution_admission_preflight_contracts.py",
      "expected_tests": [
        "tests/pytest/test_execution_admission_preflight_contracts.py",
        "tests/pytest/test_ap_execution_preflight_contract_tools.py"
      ],
      "blocked_surfaces": [
        "o3de_execution",
        "editor_runtime_execution",
        "asset_processor_execution",
        "blender_dcc_execution",
        "profiler_benchmark_execution",
        "live_screenshot_capture",
        "spawn_publish",
        "cache_live_db_access",
        "authoritative_source_uuid_claims",
        "authoritative_asset_id_claims",
        "authoritative_product_id_claims",
        "production_write",
        "engine_write"
      ],
      "allowed_surface_summary": "Requirements-only contract; broad AP execution remains blocked.",
      "failure_conditions": [
        "admission status not unadmitted",
        "receipt requirement missing",
        "sandbox boundary not enforced"
      ],
      "production_readiness_effect": "requirements_only_execution_blocked",